{
  "contract_version": "v0",
  "analysis_request_id": "example-single-trial-001",
  "intent": "selection",
  "scope": {
    "segment_id": "corn-belt-us",
    "stage": "stage-2",
    "is_discovery": false
  },
  "variables": [
    { "variable_id": "YIELD", "name": "Yield", "data_type": "numeric", "unit": "t/ha", "analyze": true },
    { "variable_id": "GRAIN_PROTEIN", "name": "Grain protein", "data_type": "numeric", "unit": "%", "analyze": true }
  ],
  "observation_units": [
    { "observation_unit_id": "P1", "germplasm_id": "G1", "environment_id": "LOC1-2025", "layout": { "row": 1, "col": 1, "rep": "R1" } },
    { "observation_unit_id": "P2", "germplasm_id": "G2", "environment_id": "LOC1-2025", "layout": { "row": 1, "col": 2, "rep": "R1" } },
    { "observation_unit_id": "P3", "germplasm_id": "G3", "environment_id": "LOC1-2025", "layout": { "row": 1, "col": 3, "rep": "R1" } },
    { "observation_unit_id": "P4", "germplasm_id": "G4", "environment_id": "LOC1-2025", "layout": { "row": 1, "col": 4, "rep": "R1" } },
    { "observation_unit_id": "P5", "germplasm_id": "G1", "environment_id": "LOC1-2025", "layout": { "row": 2, "col": 1, "rep": "R2" } },
    { "observation_unit_id": "P6", "germplasm_id": "G2", "environment_id": "LOC1-2025", "layout": { "row": 2, "col": 2, "rep": "R2" } },
    { "observation_unit_id": "P7", "germplasm_id": "G3", "environment_id": "LOC1-2025", "layout": { "row": 2, "col": 3, "rep": "R2" } },
    { "observation_unit_id": "P8", "germplasm_id": "G4", "environment_id": "LOC1-2025", "layout": { "row": 2, "col": 4, "rep": "R2" } }
  ],
  "observations": [
    { "observation_unit_id": "P1", "variable_id": "YIELD", "value": 5.2 },
    { "observation_unit_id": "P1", "variable_id": "GRAIN_PROTEIN", "value": 4.5 },
    { "observation_unit_id": "P2", "variable_id": "YIELD", "value": 4.8 },
    { "observation_unit_id": "P2", "variable_id": "GRAIN_PROTEIN", "value": 5.1 },
    { "observation_unit_id": "P3", "variable_id": "YIELD", "value": 3.7 },
    { "observation_unit_id": "P3", "variable_id": "GRAIN_PROTEIN", "value": 5.5 },
    { "observation_unit_id": "P4", "variable_id": "YIELD", "value": 5.6 },
    { "observation_unit_id": "P4", "variable_id": "GRAIN_PROTEIN", "value": 4.2 },
    { "observation_unit_id": "P5", "variable_id": "YIELD", "value": 5.0 },
    { "observation_unit_id": "P5", "variable_id": "GRAIN_PROTEIN", "value": 4.7 },
    { "observation_unit_id": "P6", "variable_id": "YIELD", "value": 4.6 },
    { "observation_unit_id": "P6", "variable_id": "GRAIN_PROTEIN", "value": 5.3 },
    { "observation_unit_id": "P7", "variable_id": "YIELD", "value": 3.6 },
    { "observation_unit_id": "P7", "variable_id": "GRAIN_PROTEIN", "value": 5.6 },
    { "observation_unit_id": "P8", "variable_id": "YIELD", "value": 5.4 },
    { "observation_unit_id": "P8", "variable_id": "GRAIN_PROTEIN", "value": 4.0 }
  ],
  "design": {
    "declared_design": "rcbd",
    "is_multi_environment": false
  },
  "relationship": { "type": "identity" },
  "objective": {
    "gates": [
      { "variable_id": "YIELD", "operator": ">=", "threshold": 4.0 }
    ],
    "index_weights": [
      { "variable_id": "YIELD", "direction": 1, "weight": 0.6 },
      { "variable_id": "GRAIN_PROTEIN", "direction": 1, "weight": 0.4 }
    ]
  },
  "options": {
    "compute_genetic_correlations": true,
    "compute_stability": false
  }
}
